{"blockers":["Every real source still requires its own exact official-source record, authority resolution, content identity, and retrieval receipt.","Repository snapshot identity, semantic closure, and an attested central pack-processor run remain unresolved."],"contract_name":"official-document-pack-seed","limitations":["This metadata-only seed records repository interface provenance and never embeds or authenticates article bodies, abstracts, datasets, or scientific claims.","The literature universe is open ended and input specific; no finite all-literature corpus is asserted."],"providers":[{"adapter_id":"declarative-catalog-v1","authority_id":"vibe-dft-skills-repository-contracts","input_id":"repository-contracts-literature-plan","provider_id":"vibe-dft-skills","source_ref":{"path":"skills/literature-to-dft-plan/references/source-catalog-repository-interfaces.json","sha256":"3766c333fb2d74d8e48d6d896074578548b06b1b145a4caddb4a988dde9b0b03"}}],"schema_version":"1.0","scope_catalog_ref":{"path":"skills/literature-to-dft-plan/references/source-pack-scope-catalog.json","sha256":"0c1e6dfb8b7760076b728e0aff46b0d3fe2ece4bab572301a8ea6024156e22ff"},"scope_extractor_id":"repository-native-source-scope-v1","skill_id":"literature-to-dft-plan","status_ceiling":"blocked"}
