{"blockers":["The reviewed official LASP Hub and 3.7.3 download/manual route are HTTP-only and cannot satisfy the central HTTPS authority contract.","No authorized exact LASP 3.7.3 manual or example identity is retained, so native syntax, units, defaults, files, completion, restart, resources, compatibility, and execution remain blocked.","Complete software, interface, model, dataset, and external-access artifact identities are unavailable from the HTTPS literature."],"contract_name":"official-document-pack-seed","limitations":["The active input contains metadata-only identities for four author-paper DOI records and one external PMC article response.","The LASP 3.7 literature context cannot be promoted to a version-matched 3.7.3 operational contract.","No article body, manual, example, binary, edition, interface, model, dataset, structure, trajectory, or calculation output is stored.","The HTTP LASP Hub URLs are recorded only as blocked proposal metadata and never as source-catalog locators."],"providers":[{"adapter_id":"declarative-catalog-v1","authority_id":"lasp-author-literature","input_id":"lasp-author-literature","provider_id":"lasp-authors","source_ref":{"path":"skills/lasp-rigorous-simulations/references/source-catalog-lasp-author-literature.json","sha256":"7f9192bf2db7261a05c8e6adc720aa39b9cbefd8e9a26c2f0c2de3de5a849363"}}],"schema_version":"1.0","scope_catalog_ref":{"path":"skills/lasp-rigorous-simulations/references/source-pack-scope-catalog.json","sha256":"500d39f6aaf34b1095b7779152e0f5530acd65ef12c8e6e058bcaaae6f4ca4ed"},"scope_extractor_id":"lasp-document-scope-v1","skill_id":"lasp-rigorous-simulations","status_ceiling":"blocked"}
