{"blockers":["Provider-required subjects remain blocked until exact document bodies, generated manual replay, and semantic slices exist.","Compiled package/style availability, potential identity, and native binary behavior require separate execution provenance and cannot be inferred from documentation."],"contract_name":"official-document-pack-seed","limitations":["The exact release documentation tree is inventoried as metadata only; document bodies, generated HTML, examples, potentials, and binary help remain external."],"providers":[{"adapter_id":"declarative-catalog-v1","authority_id":"lammps-release-source-docs-patch-4jul2026","input_id":"lammps-docs","provider_id":"lammps","source_ref":{"path":"skills/lammps-rigorous-simulations/references/source-pack-source-catalog-lammps.json","sha256":"620d53eeb2d481292281aeac45fd861beadaeb74ce616cc0e2bb29d4bcd2604c"}}],"schema_version":"1.0","scope_catalog_ref":{"path":"skills/lammps-rigorous-simulations/references/source-pack-scope-catalog.json","sha256":"fe0df7fdfd3d1558d3ff4ec8f309923f0f3e5e6b8199bc88dbefab2dfb76d52e"},"scope_extractor_id":"reviewed-semantic-scope-v1","skill_id":"lammps-rigorous-simulations","status_ceiling":"blocked"}
