{"blockers":["Input-specific official-source, manuscript, artifact, and human-decision authenticity remain external obligations.","Repository snapshot identity, semantic closure, and an attested central pack-processor run remain unresolved."],"contract_name":"official-document-pack-seed","limitations":["This pack stores repository-interface identities and semantic scope only; it embeds no reviewer text, manuscript, literature body, scientific result, or response submission.","Literature and manuscript evidence authorities are runtime-input-specific and are never replaced by a universal review-response provider."],"providers":[{"adapter_id":"declarative-catalog-v1","authority_id":"vibe-dft-skills-repository-contracts","input_id":"repository-contracts-review-response","provider_id":"vibe-dft-skills","source_ref":{"path":"skills/dft-review-response/references/source-catalog-repository-interfaces.json","sha256":"ca91ab7c293d7e6f62867cbe620e25364f169fbfd3af7ee6df867b9cf6275d31"}}],"schema_version":"1.0","scope_catalog_ref":{"path":"skills/dft-review-response/references/source-pack-scope-catalog.json","sha256":"739bb8666afebf2d9d1aca7550312ded6e8e6b2a909d9954ddc41b42613c2662"},"scope_extractor_id":"repository-native-source-scope-v1","skill_id":"dft-review-response","status_ceiling":"blocked"}
