{"blockers":["No live cluster version, site policy, scheduler client, accounting configuration, or native execution was validated.","Slurm documentation snapshot identity, the OpenPBS ngpus rendering assumption, repository snapshot identity, and central processor attestation remain unresolved."],"contract_name":"official-document-pack-seed","limitations":["The pack is metadata-only: scheduler manuals, specifications, and repository contract bodies remain external.","Slurm receipts identify rolling 26.05 pages at retrieval, not an installed cluster version or site policy.","OpenPBS v23.06.06 sources cover a synthetic candidate surface only; they do not activate an OpenPBS operational route."],"providers":[{"adapter_id":"declarative-catalog-v1","authority_id":"vibe-dft-skills-repository-contracts","input_id":"repository-contracts-hpc","provider_id":"vibe-dft-skills","source_ref":{"path":"skills/dft-hpc-execution/references/source-catalog-repository-interfaces.json","sha256":"79d0a91f69d3641314c55fe10a64f3df5e4ae2c1c940cccdc43f1652576509f3"}},{"adapter_id":"declarative-catalog-v1","authority_id":"json-schema-standard-2020-12","input_id":"json-schema-2020-12","provider_id":"json-schema","source_ref":{"path":"skills/dft-hpc-execution/references/source-catalog-json-schema-2020-12.json","sha256":"2379a3dfb774b97dfeb1ac0ebca72fbec8d9e9b45692d7a7976af9eceac80873"}},{"adapter_id":"declarative-catalog-v1","authority_id":"slurm-live-manual-26-05","input_id":"slurm-26-05-live","provider_id":"slurm","source_ref":{"path":"skills/dft-hpc-execution/references/source-catalog-slurm-26-05-live.json","sha256":"1db5e7879c4807bcfefb18cdcaa9acf8422155f26a4614860d55b0aa36d87b6e"}},{"adapter_id":"declarative-catalog-v1","authority_id":"openpbs-release-docs-23-06-06","input_id":"openpbs-23-06-06","provider_id":"openpbs","source_ref":{"path":"skills/dft-hpc-execution/references/source-catalog-openpbs-23-06-06.json","sha256":"51784a8cea87b402fbcf87a4a19ab54110a8ce3a3a6950fe9a6c300659d60ecf"}}],"schema_version":"1.0","scope_catalog_ref":{"path":"skills/dft-hpc-execution/references/source-pack-scope-catalog.json","sha256":"d73a125d15164582fcbb2c7be4f1fc1140affe6f2aa732aae0ed7ef14e309c94"},"scope_extractor_id":"repository-native-source-scope-v1","skill_id":"dft-hpc-execution","status_ceiling":"blocked"}
