{
  "blockers": [],
  "contract_name": "official-document-pack-seed",
  "limitations": [
    "Coverage is metadata-only and bounded to five public Gaussian 16 Rev. C.01 WordPress page records plus the public Rev. C.02 release-note record and platform PDF.",
    "The C.01 keyword, IOp, utility, option, and user-reference leaf graph is not completely enumerated or receipt-bound.",
    "The C.02 materials are a release delta and cannot establish a complete version-matched C.02 reference.",
    "Licensed manuals, examples, binaries, basis payloads, checkpoints, user data, calculation artifacts, execution authorization, convergence, and scientific acceptance remain outside this pack."
  ],
  "providers": [
    {
      "adapter_id": "declarative-catalog-v1",
      "authority_id": "gaussian-g16-c01-public-reference",
      "input_id": "gaussian-g16-c01-public",
      "provider_id": "gaussian",
      "source_ref": {
        "path": "skills/gaussian-rigorous-calculations/references/source-catalog-g16-c01.json",
        "sha256": "1df49a5e66bc8feb9952fa3971df78c138c08a2ffe763e8e26ccec7339a9de59"
      }
    },
    {
      "adapter_id": "declarative-catalog-v1",
      "authority_id": "gaussian-g16-c02-release-materials",
      "input_id": "gaussian-g16-c02-delta",
      "provider_id": "gaussian",
      "source_ref": {
        "path": "skills/gaussian-rigorous-calculations/references/source-catalog-g16-c02.json",
        "sha256": "7a86a8304545d97684f92b5687b33dfa8e8bd8f49ea7c74e9b7baef9dce5fad9"
      }
    }
  ],
  "schema_version": "1.0",
  "scope_catalog_ref": {
    "path": "skills/gaussian-rigorous-calculations/references/source-pack-scope-catalog.json",
    "sha256": "931a111689102995a41daa736b97cfed46aa22893451148863563771b79dee1c"
  },
  "scope_extractor_id": "gaussian-document-scope-v1",
  "skill_id": "gaussian-rigorous-calculations",
  "status_ceiling": "partial"
}
