{"blockers":["Capability-only providers without exact authorities remain explicit excluded gaps.","CP2K input/output tools, critic2, phonopy, pymatgen, py4vasp, Sumo, PyProcar, Wannier90, and several Python libraries lack exact provider bindings."],"contract_name":"official-document-pack-seed","limitations":["The pack stores metadata and receipts only and does not embed provider text.","Route maturity is copied exactly from the canonical observable registry and is never raised."],"providers":[{"adapter_id":"declarative-catalog-v1","authority_id":"ase-release-source-docs-3-29-0","input_id":"ase-3-29-postprocess","provider_id":"ase","source_ref":{"path":"skills/dft-postprocess/references/source-pack-inputs/ase-3-29-postprocess.json","sha256":"7892aba7d8df24f8b52e76f9047f1ec718dd953cff02b473f609ec11d74312cf"}},{"adapter_id":"declarative-catalog-v1","authority_id":"bader-1-05-official-page","input_id":"bader-1-05","provider_id":"bader","source_ref":{"path":"skills/dft-postprocess/references/source-pack-inputs/bader-1-05.json","sha256":"96930885564b9284cd432d2822aab1a27cac2552bec7674d40f047d66827f8b7"}},{"adapter_id":"declarative-catalog-v1","authority_id":"cp2k-official-manual","input_id":"cp2k-2026-2-postprocess","provider_id":"cp2k","source_ref":{"path":"skills/dft-postprocess/references/source-pack-inputs/cp2k-2026-2-postprocess.json","sha256":"bad66427d07c899a7810aae179c7b0b0993a8313c8e07624bc2396c506acddd7"}},{"adapter_id":"declarative-catalog-v1","authority_id":"qe-official-docs","input_id":"qe-7-5-postprocess","provider_id":"qe","source_ref":{"path":"skills/dft-postprocess/references/source-pack-inputs/qe-7-5-postprocess.json","sha256":"a01875e3962442c689b33717cb6da4a9397a554c4ab2a99c0bcebb22c8b07204"}},{"adapter_id":"declarative-catalog-v1","authority_id":"siesta-release-source-docs","input_id":"siesta-5-4-2-postprocess","provider_id":"siesta","source_ref":{"path":"skills/dft-postprocess/references/source-pack-inputs/siesta-5-4-2-postprocess.json","sha256":"911f6e1c20e852536bab7e9a81690202d386e37ab008f9acf76b5297df475245"}},{"adapter_id":"declarative-catalog-v1","authority_id":"vasp-official-wiki","input_id":"vasp-wiki-postprocess","provider_id":"vasp","source_ref":{"path":"skills/dft-postprocess/references/source-pack-inputs/vasp-wiki-postprocess.json","sha256":"6288522e2d3adfb145020f22edff35afd6f523697f70253fada16b03c88978ad"}},{"adapter_id":"declarative-catalog-v1","authority_id":"vaspkit-1-5-documentation","input_id":"vaspkit-docs","provider_id":"vaspkit","source_ref":{"path":"skills/dft-postprocess/references/source-pack-inputs/vaspkit-docs.json","sha256":"7d339f7c45c546b2605ed5e0ab35ccb938853f3ce62e3c758f334b0bcdfe3293"}},{"adapter_id":"declarative-catalog-v1","authority_id":"vesta-official-manual","input_id":"vesta-manual","provider_id":"vesta","source_ref":{"path":"skills/dft-postprocess/references/source-pack-inputs/vesta-manual.json","sha256":"dc5d0e9f1cbec3030a8bb1781b5fbb7d1db8f5175209668a7239f43e526f964b"}}],"schema_version":"1.0","scope_catalog_ref":{"path":"skills/dft-postprocess/references/source-pack-scope.json","sha256":"01f10ae132d6d5af391883fdbe572bf07197ec7fb0c35c2df2ba5285747b9348"},"scope_extractor_id":"dft-postprocess-scope-v1","skill_id":"dft-postprocess","status_ceiling":"blocked"}
