{"blockers":["Provider-required subjects remain blocked until exact document bodies, generated documentation replay, and semantic slices exist.","Native GPU build/runtime identity and independent model/data byte-identity and provenance closure remain absent."],"contract_name":"official-document-pack-seed","limitations":["The exact v5.3 doc and examples trees are inventoried as metadata only; document/example bodies, models, datasets, trained weights, and outputs remain external."],"providers":[{"adapter_id":"declarative-catalog-v1","authority_id":"gpumd-release-source-docs-5-3","input_id":"gpumd-docs","provider_id":"gpumd","source_ref":{"path":"skills/gpumd-rigorous-simulations/references/source-pack-source-catalog-gpumd.json","sha256":"9f5d851d8a5ea39150bb19e9a64cab9c42078c93c2d84c68c2ebf3fd6779b92d"}}],"schema_version":"1.0","scope_catalog_ref":{"path":"skills/gpumd-rigorous-simulations/references/source-pack-scope-catalog.json","sha256":"d219d3a16c2c7cb9723cf9f5014f7797fa635a4ac72c0e4badc3a69c3e762cc6"},"scope_extractor_id":"reviewed-semantic-scope-v1","skill_id":"gpumd-rigorous-simulations","status_ceiling":"blocked"}
