{"blockers":["Secure HTTPS retrieval is unavailable in the reviewed environment and the known exact receipt came from HTTP.","The 1,150-page manual has no complete page/section extraction or per-slice hash ledger.","Private manual access and derived-manual storage identities remain unresolved.","Program 2026.7.15 and manual 2026.7.10 are distinct version surfaces, and native execution remains unvalidated."],"contract_name":"official-document-pack-seed","limitations":["Multiwfn manual and quick-start contents are restricted external-only; only hash-bound external receipts and repo-authored metadata evidence are retained."],"providers":[{"adapter_id":"declarative-catalog-v1","authority_id":"multiwfn-manual-external-identity-2026-7-10","input_id":"multiwfn-manual","provider_id":"multiwfn","source_ref":{"path":"skills/multiwfn-wavefunction-analysis/references/source-pack-source-catalog-multiwfn.json","sha256":"3569612910d88a566a6f58ced31e71688d164b1e59a4da150b713bb3f4d50950"}}],"schema_version":"1.0","scope_catalog_ref":{"path":"skills/multiwfn-wavefunction-analysis/references/source-pack-scope-catalog.json","sha256":"ebfcd1ee70c16893b85efd6d8582a642c6c659c31d340be187c51e438227e027"},"scope_extractor_id":"reviewed-semantic-scope-v1","skill_id":"multiwfn-wavefunction-analysis","status_ceiling":"blocked"}
